{
  "iss": "ssot:markstokes",
  "sub": "ssot:focusco",
  "aud": "intent-agent.focusmode.local",
  "request_scope": ["interests", "ad_preferences"],
  "reason": "Better ad targeting for ADHD users",
  "issued_at": "2025-07-27T08:10:00Z",
  "expires_at": "2025-08-27T08:10:00Z",
  "delegated_by": null,
  "signature": "0xSHA256..."
}
